{
  "schemaVersion": "OwlCodaRunKitPublicVerificationBundleV1",
  "source": {"fingerprintAlgorithm": "sha256-canonical-json-v1", "fingerprint": "sha256:6cbc7b5570b8ae2cf63857ade8fc9362bf78603488c594b6b3db9b647b6d1fac", "payload": {"manifestVersion": 1, "files": [{"path": "src/order.json", "sha256": "aaaaaaaaaaaaaaaaaaaaaaaaaaaaaaaaaaaaaaaaaaaaaaaaaaaaaaaaaaaaaaaa"}]}},
  "verificationContext": {"fingerprintAlgorithm": "sha256-canonical-json-v1", "fingerprint": "sha256:a617e3a705a0e45c4205b63635acff13a97d91707e63165fe9ac416e253befc4", "payload": {"platform": "darwin-arm64", "commands": [{"executable": "/usr/bin/node", "argv": ["--test", "fixtures"], "cwd": "."}]}},
  "receipts": [
    {"schemaVersion": "OwlCodaRunKitPublicVerificationReceiptV1", "receiptId": "receipt-blocked", "status": "blocked", "replacesReceiptId": null, "sourceFingerprint": "sha256:6cbc7b5570b8ae2cf63857ade8fc9362bf78603488c594b6b3db9b647b6d1fac", "verificationContextFingerprint": "sha256:a617e3a705a0e45c4205b63635acff13a97d91707e63165fe9ac416e253befc4", "authorizationGranted": false, "gitAuthorization": false, "releaseAuthorization": false, "artifactMutationAuthorization": false, "businessActionAuthorization": false}
  ],
  "closeout": {"schemaVersion": "OwlCodaRunKitPublicCloseoutV1", "decision": "blocked", "activeReceiptId": "receipt-blocked", "sourceFingerprint": "sha256:6cbc7b5570b8ae2cf63857ade8fc9362bf78603488c594b6b3db9b647b6d1fac", "verificationContextFingerprint": "sha256:a617e3a705a0e45c4205b63635acff13a97d91707e63165fe9ac416e253befc4", "authorizationGranted": false, "gitAuthorization": false, "releaseAuthorization": false, "artifactMutationAuthorization": false, "businessActionAuthorization": false}
}
